{
  "kind": "check",
  "produced_by": {
    "script": "scripts/write-receipt.mjs",
    "commit": "0a7e7a4041243a12fdf1f175f426e930e7f9d771"
  },
  "at": "2026-10-24T10:03:21.780Z",
  "inputs": {
    "source": "apps/web/review/latest/report.json"
  },
  "summary": {
    "built_from": "dist",
    "generated_at": "2026-10-24T10:02:20.275Z"
  },
  "topic": "web-tools-review",
  "raw": {
    "built_from": "dist",
    "generated_at": "2026-10-24T10:02:20.275Z",
    "pages": [
      {
        "path": "/",
        "viewport": "desktop-1440",
        "theme": "light",
        "status": 200,
        "overflow_px": 0,
        "console_errors": [],
        "axe": {
          "violations": [],
          "passes": 53,
          "incomplete": []
        },
        "screenshot": "home--desktop-1440-light.jpg",
        "page_height_px": 6872,
        "screenshot_clipped_at_px": null
      },
      {
        "path": "/",
        "viewport": "desktop-1440",
        "theme": "dark",
        "status": 200,
        "overflow_px": 0,
        "console_errors": [],
        "axe": {
          "violations": [],
          "passes": 53,
          "incomplete": []
        },
        "screenshot": "home--desktop-1440-dark.jpg",
        "page_height_px": 6872,
        "screenshot_clipped_at_px": null
      },
      {
        "path": "/",
        "viewport": "mobile-390",
        "theme": "light",
        "status": 200,
        "overflow_px": 0,
        "console_errors": [],
        "axe": {
          "violations": [],
          "passes": 54,
          "incomplete": [
            {
              "id": "color-contrast",
              "nodes": 3
            }
          ]
        },
        "screenshot": "home--mobile-390-light.jpg",
        "page_height_px": 9474,
        "screenshot_clipped_at_px": 7000
      },
      {
        "path": "/",
        "viewport": "mobile-390",
        "theme": "dark",
        "status": 200,
        "overflow_px": 0,
        "console_errors": [],
        "axe": {
          "violations": [],
          "passes": 54,
          "incomplete": [
            {
              "id": "color-contrast",
              "nodes": 3
            }
          ]
        },
        "screenshot": "home--mobile-390-dark.jpg",
        "page_height_px": 9443,
        "screenshot_clipped_at_px": 7000
      },
      {
        "path": "/tools",
        "viewport": "desktop-1440",
        "theme": "light",
        "status": 200,
        "overflow_px": 0,
        "console_errors": [],
        "axe": {
          "violations": [],
          "passes": 47,
          "incomplete": []
        },
        "screenshot": "tools--desktop-1440-light.jpg",
        "page_height_px": 31365,
        "screenshot_clipped_at_px": 7000
      },
      {
        "path": "/tools",
        "viewport": "desktop-1440",
        "theme": "dark",
        "status": 200,
        "overflow_px": 0,
        "console_errors": [],
        "axe": {
          "violations": [],
          "passes": 47,
          "incomplete": []
        },
        "screenshot": "tools--desktop-1440-dark.jpg",
        "page_height_px": 31365,
        "screenshot_clipped_at_px": 7000
      },
      {
        "path": "/tools",
        "viewport": "mobile-390",
        "theme": "light",
        "status": 200,
        "overflow_px": 0,
        "console_errors": [],
        "axe": {
          "violations": [],
          "passes": 47,
          "incomplete": []
        },
        "screenshot": "tools--mobile-390-light.jpg",
        "page_height_px": 47196,
        "screenshot_clipped_at_px": 7000
      },
      {
        "path": "/tools",
        "viewport": "mobile-390",
        "theme": "dark",
        "status": 200,
        "overflow_px": 0,
        "console_errors": [],
        "axe": {
          "violations": [],
          "passes": 47,
          "incomplete": []
        },
        "screenshot": "tools--mobile-390-dark.jpg",
        "page_height_px": 47196,
        "screenshot_clipped_at_px": 7000
      },
      {
        "path": "/tools/iban-validate",
        "viewport": "desktop-1440",
        "theme": "light",
        "status": 200,
        "overflow_px": 0,
        "console_errors": [],
        "axe": {
          "violations": [],
          "passes": 52,
          "incomplete": []
        },
        "screenshot": "tools-iban-validate--desktop-1440-light.jpg",
        "page_height_px": 3854,
        "screenshot_clipped_at_px": null
      },
      {
        "path": "/tools/iban-validate",
        "viewport": "desktop-1440",
        "theme": "dark",
        "status": 200,
        "overflow_px": 0,
        "console_errors": [],
        "axe": {
          "violations": [],
          "passes": 52,
          "incomplete": []
        },
        "screenshot": "tools-iban-validate--desktop-1440-dark.jpg",
        "page_height_px": 3854,
        "screenshot_clipped_at_px": null
      },
      {
        "path": "/tools/iban-validate",
        "viewport": "mobile-390",
        "theme": "light",
        "status": 200,
        "overflow_px": 0,
        "console_errors": [],
        "axe": {
          "violations": [],
          "passes": 53,
          "incomplete": []
        },
        "screenshot": "tools-iban-validate--mobile-390-light.jpg",
        "page_height_px": 5705,
        "screenshot_clipped_at_px": null
      },
      {
        "path": "/tools/iban-validate",
        "viewport": "mobile-390",
        "theme": "dark",
        "status": 200,
        "overflow_px": 0,
        "console_errors": [],
        "axe": {
          "violations": [],
          "passes": 53,
          "incomplete": []
        },
        "screenshot": "tools-iban-validate--mobile-390-dark.jpg",
        "page_height_px": 5705,
        "screenshot_clipped_at_px": null
      },
      {
        "path": "/tools/invoice-extract",
        "viewport": "desktop-1440",
        "theme": "light",
        "status": 200,
        "overflow_px": 0,
        "console_errors": [],
        "axe": {
          "violations": [],
          "passes": 49,
          "incomplete": []
        },
        "screenshot": "tools-invoice-extract--desktop-1440-light.jpg",
        "page_height_px": 4555,
        "screenshot_clipped_at_px": null
      },
      {
        "path": "/tools/invoice-extract",
        "viewport": "desktop-1440",
        "theme": "dark",
        "status": 200,
        "overflow_px": 0,
        "console_errors": [],
        "axe": {
          "violations": [],
          "passes": 49,
          "incomplete": []
        },
        "screenshot": "tools-invoice-extract--desktop-1440-dark.jpg",
        "page_height_px": 4555,
        "screenshot_clipped_at_px": null
      },
      {
        "path": "/tools/invoice-extract",
        "viewport": "mobile-390",
        "theme": "light",
        "status": 200,
        "overflow_px": 0,
        "console_errors": [],
        "axe": {
          "violations": [],
          "passes": 50,
          "incomplete": []
        },
        "screenshot": "tools-invoice-extract--mobile-390-light.jpg",
        "page_height_px": 6748,
        "screenshot_clipped_at_px": null
      },
      {
        "path": "/tools/invoice-extract",
        "viewport": "mobile-390",
        "theme": "dark",
        "status": 200,
        "overflow_px": 0,
        "console_errors": [],
        "axe": {
          "violations": [],
          "passes": 50,
          "incomplete": []
        },
        "screenshot": "tools-invoice-extract--mobile-390-dark.jpg",
        "page_height_px": 6748,
        "screenshot_clipped_at_px": null
      },
      {
        "path": "/tools/swedish-company-data",
        "viewport": "desktop-1440",
        "theme": "light",
        "status": 200,
        "overflow_px": 0,
        "console_errors": [],
        "axe": {
          "violations": [],
          "passes": 49,
          "incomplete": []
        },
        "screenshot": "tools-swedish-company-data--desktop-1440-light.jpg",
        "page_height_px": 5612,
        "screenshot_clipped_at_px": null
      },
      {
        "path": "/tools/swedish-company-data",
        "viewport": "desktop-1440",
        "theme": "dark",
        "status": 200,
        "overflow_px": 0,
        "console_errors": [],
        "axe": {
          "violations": [],
          "passes": 49,
          "incomplete": []
        },
        "screenshot": "tools-swedish-company-data--desktop-1440-dark.jpg",
        "page_height_px": 5612,
        "screenshot_clipped_at_px": null
      },
      {
        "path": "/tools/swedish-company-data",
        "viewport": "mobile-390",
        "theme": "light",
        "status": 200,
        "overflow_px": 0,
        "console_errors": [],
        "axe": {
          "violations": [],
          "passes": 50,
          "incomplete": []
        },
        "screenshot": "tools-swedish-company-data--mobile-390-light.jpg",
        "page_height_px": 8733,
        "screenshot_clipped_at_px": 7000
      },
      {
        "path": "/tools/swedish-company-data",
        "viewport": "mobile-390",
        "theme": "dark",
        "status": 200,
        "overflow_px": 0,
        "console_errors": [],
        "axe": {
          "violations": [],
          "passes": 50,
          "incomplete": []
        },
        "screenshot": "tools-swedish-company-data--mobile-390-dark.jpg",
        "page_height_px": 8733,
        "screenshot_clipped_at_px": 7000
      }
    ]
  }
}
