{
  "kind": "test-run",
  "produced_by": {
    "script": "apps/api: vitest run entity-resolve.test.ts lei-lookup.test.ts vendor-terms.test.ts data-access-manifests.test.ts",
    "commit": "beafcb62649d4ed2f4944a74e9e420c94688be2d"
  },
  "at": "2026-10-26T10:57:14.689Z",
  "inputs": {
    "source": "/tmp/entity-test-evidence.json"
  },
  "summary": {
    "success": true,
    "numTotalTests": 104,
    "numPassedTests": 104,
    "numFailedTests": 0,
    "numTotalTestSuites": 11,
    "numPassedTestSuites": 11,
    "unrecorded_shared_client_probe_rejected": true
  },
  "topic": "entity-resolve",
  "raw": {
    "success": true,
    "numTotalTests": 104,
    "numPassedTests": 104,
    "numFailedTests": 0,
    "numTotalTestSuites": 11,
    "numPassedTestSuites": 11,
    "files": [
      {
        "file": "apps/api/src/capabilities/entity-resolve.test.ts",
        "status": "passed"
      },
      {
        "file": "apps/api/src/capabilities/lei-lookup.test.ts",
        "status": "passed"
      },
      {
        "file": "apps/api/src/lib/data-access-manifests.test.ts",
        "status": "passed"
      },
      {
        "file": "apps/api/src/lib/vendor-terms.test.ts",
        "status": "passed"
      }
    ],
    "unrecorded_shared_client_probe_rejected": true
  }
}
