{
  "kind": "test-run",
  "produced_by": {
    "script": "scripts/write-receipt.mjs",
    "commit": "813b815a46b38f2477372773f6824bfcff0e6fd7"
  },
  "at": "2026-10-29T01:10:45.259Z",
  "inputs": {
    "source": "/tmp/claude-0/r3.json"
  },
  "summary": {
    "integration_tests": 365,
    "failed": 0,
    "once": 29,
    "every_boot": 45
  },
  "topic": "h7d-applied-block-skip-review",
  "raw": {
    "ok": true,
    "round": 2,
    "postgres": "16.15",
    "policy": {
      "once": 29,
      "every_boot": 45
    },
    "integration_lane": {
      "test_files_passed": 38,
      "tests_passed": 365,
      "failed": 0
    },
    "api_suite": {
      "files_passed": 381,
      "tests_passed": 7740,
      "failed": 0
    },
    "new_integration_tests": [
      "dropped validated column fails schema validation; STARTUP_MIGRATIONS_FORCE=1 restores it",
      "record failure is non-fatal"
    ],
    "mutations_caught": [
      "force env ignored",
      "record failure rethrown",
      "0096 marked once"
    ]
  }
}
