{
  "kind": "test-run",
  "produced_by": {
    "script": "apps/api (vitest): test-input-drift.test.ts, startup-migrations.test.ts, onboard-guards.test.ts, onboard-scheduling.test.ts, onboarding-gates-orchestrator.test.ts, onboard-dependency-health.test.ts",
    "commit": "0921b51dda285b19bfefb51cb31f5d660d64a07e"
  },
  "at": "2026-09-12T16:32:32.682Z",
  "inputs": {
    "source": "C:/tmp/vitest-summary.json"
  },
  "summary": {
    "ok": true,
    "numTotalTests": 190,
    "numPassedTests": 190,
    "numFailedTests": 0,
    "numTotalTestSuites": 59
  },
  "topic": "test-input-manifest-drift",
  "raw": {
    "ok": true,
    "numTotalTests": 190,
    "numPassedTests": 190,
    "numFailedTests": 0,
    "numTotalTestSuites": 59,
    "files": [
      "C:/Users/pette/Projects/strale/.claude/worktrees/agent-a8bb7b5422a2c19ef/apps/api/src/lib/onboard-dependency-health.test.ts",
      "C:/Users/pette/Projects/strale/.claude/worktrees/agent-a8bb7b5422a2c19ef/apps/api/src/lib/onboard-guards.test.ts",
      "C:/Users/pette/Projects/strale/.claude/worktrees/agent-a8bb7b5422a2c19ef/apps/api/src/lib/onboard-scheduling.test.ts",
      "C:/Users/pette/Projects/strale/.claude/worktrees/agent-a8bb7b5422a2c19ef/apps/api/src/lib/onboarding-gates-orchestrator.test.ts",
      "C:/Users/pette/Projects/strale/.claude/worktrees/agent-a8bb7b5422a2c19ef/apps/api/src/lib/startup-migrations.test.ts",
      "C:/Users/pette/Projects/strale/.claude/worktrees/agent-a8bb7b5422a2c19ef/apps/api/src/lib/test-input-drift.test.ts"
    ]
  }
}
